{
  "$schema": "./schema.json",
  "version": 1,
  "walk": {
    "maxDepth": 10,
    "skipNames": [".git", ".hg", ".svn", "node_modules", ".Trash"],
    "skipPaths": [
      "~/Library", "~/Applications", "~/Pictures", "~/Music", "~/Movies", "~/Videos", "~/.Trash", "~/snap", "~/.var",
      "~/.npm", "~/.yarn", "~/.bun", "~/.deno", "~/.nvm", "~/.cargo", "~/.rustup", "~/.pyenv", "~/.rbenv", "~/.gem",
      "~/.gradle", "~/.m2", "~/.android", "~/.konan", "~/.pub-cache", "~/.dartServer", "~/fvm", "~/.fvm",
      "~/.cocoapods", "~/.nuget", "~/.stack", "~/.cabal", "~/.hex", "~/.mix", "~/go/pkg",
      "~/.cache", "~/.local", "~/.config", "~/.docker", "~/.orbstack", "~/.oh-my-zsh", "~/miniconda3", "~/anaconda3",
      "~/.vscode", "~/.vscode-insiders", "~/.cursor", "~/.windsurf", "~/.kiro", "~/.antigravity",
      "~/.claude", "~/.codex", "~/.gemini", "~/.ollama", "~/.lmstudio", "~/.terraform.d"
    ]
  },
  "templates": {
    "chromium": [
      { "path": "Cache", "safety": "safe" },
      { "path": "Code Cache", "safety": "safe" },
      { "path": "GPUCache", "safety": "safe" },
      { "path": "DawnGraphiteCache", "safety": "safe" },
      { "path": "DawnWebGPUCache", "safety": "safe" },
      { "path": "Service Worker/CacheStorage", "safety": "safe" },
      { "path": "Crashpad", "safety": "safe" }
    ],
    "vscode": [
      { "path": "CachedData", "safety": "safe" },
      { "path": "CachedExtensionVSIXs", "safety": "safe" },
      { "path": "CachedProfilesData", "safety": "safe" },
      { "path": "logs", "safety": "safe" },
      { "path": "Cache", "safety": "safe" },
      { "path": "Code Cache", "safety": "safe" },
      { "path": "GPUCache", "safety": "safe" },
      { "path": "DawnGraphiteCache", "safety": "safe" },
      { "path": "DawnWebGPUCache", "safety": "safe" },
      { "path": "Service Worker/CacheStorage", "safety": "safe" },
      { "path": "Crashpad", "safety": "safe" },
      {
        "path": "User/workspaceStorage",
        "safety": "caution",
        "description": "Per-workspace state: open editors, extension data, chat history."
      }
    ]
  },
  "rules": [
    { "id": "node.modules", "type": "artifact", "eco": "node", "label": "node_modules", "dirs": ["node_modules"], "markers": ["package.json"], "safety": "rebuild", "restore": "npm install" },
    { "id": "node.output", "type": "artifact", "eco": "node", "label": "Framework build output", "dirs": [".next", ".nuxt", ".output", ".svelte-kit", ".docusaurus", ".vercel/output"], "markers": ["package.json"], "safety": "rebuild", "restore": "npm run build" },
    { "id": "node.dist", "type": "artifact", "eco": "node", "label": "Build output", "dirs": ["dist", "storybook-static", "coverage"], "markers": ["package.json"], "gitIgnored": true, "safety": "rebuild", "restore": "npm run build" },
    { "id": "node.cache", "type": "artifact", "eco": "node", "label": "Tool cache", "dirs": [".turbo", ".parcel-cache", ".angular/cache", ".vite", ".expo", ".nx/cache"], "markers": ["package.json"], "safety": "safe" },

    { "id": "rust.target", "type": "artifact", "eco": "rust", "label": "Cargo target", "dirs": ["target"], "markers": ["Cargo.toml"], "safety": "rebuild", "restore": "cargo build" },

    { "id": "python.venv", "type": "artifact", "eco": "python", "label": "Virtual environment", "dirs": [".venv", "venv", "env", ".env"], "inside": ["pyvenv.cfg"], "safety": "caution", "restore": "uv sync  # or: pip install -r requirements.txt", "description": "Packages installed by hand are lost; anything listed in the project files can be reinstalled." },
    { "id": "python.cache", "type": "artifact", "eco": "python", "label": "Tool cache", "dirs": [".pytest_cache", ".mypy_cache", ".ruff_cache", ".hypothesis", ".tox", ".nox"], "safety": "safe" },

    { "id": "apple.pods", "type": "artifact", "eco": "apple", "label": "CocoaPods", "dirs": ["Pods"], "markers": ["Podfile"], "gitIgnored": true, "safety": "rebuild", "restore": "pod install" },
    { "id": "apple.spm", "type": "artifact", "eco": "apple", "label": "SwiftPM build", "dirs": [".build", ".swiftpm"], "markers": ["Package.swift"], "safety": "rebuild", "restore": "swift build" },

    { "id": "android.build", "type": "artifact", "eco": "android", "label": "Gradle build", "dirs": ["build"], "markers": ["build.gradle", "build.gradle.kts", "settings.gradle", "settings.gradle.kts"], "gitIgnored": true, "safety": "rebuild", "restore": "./gradlew assemble" },
    { "id": "android.cache", "type": "artifact", "eco": "android", "label": "Gradle project cache", "dirs": [".gradle", ".kotlin", ".cxx", ".externalNativeBuild"], "markers": ["build.gradle", "build.gradle.kts", "settings.gradle", "settings.gradle.kts"], "safety": "rebuild", "restore": "./gradlew assemble" },
    { "id": "java.maven", "type": "artifact", "eco": "java", "label": "Maven target", "dirs": ["target"], "markers": ["pom.xml"], "safety": "rebuild", "restore": "mvn package" },

    { "id": "flutter.build", "type": "artifact", "eco": "flutter", "label": "Flutter build", "dirs": ["build", ".dart_tool"], "markers": ["pubspec.yaml"], "gitIgnored": true, "safety": "rebuild", "restore": "flutter pub get" },

    { "id": "php.vendor", "type": "artifact", "eco": "php", "label": "Composer vendor", "dirs": ["vendor"], "markers": ["composer.json"], "gitIgnored": true, "safety": "rebuild", "restore": "composer install" },
    { "id": "php.laravel-cache", "type": "artifact", "eco": "php", "label": "Laravel cache", "dirs": ["storage/framework/cache", "storage/framework/views", "bootstrap/cache"], "markers": ["artisan"], "safety": "rebuild", "restore": "git checkout -- storage/framework bootstrap/cache", "description": "Laravel needs these folders to exist; git checkout brings back the empty folders." },
    { "id": "php.laravel-logs", "type": "artifact", "eco": "php", "label": "Laravel logs", "dirs": ["storage/logs"], "markers": ["artisan"], "safety": "rebuild", "restore": "git checkout -- storage/logs" },
    { "id": "php.laravel-sessions", "type": "artifact", "eco": "php", "label": "Laravel sessions", "dirs": ["storage/framework/sessions"], "markers": ["artisan"], "safety": "caution", "restore": "git checkout -- storage/framework/sessions", "description": "Signs out everyone using file sessions." },
    { "id": "php.symfony", "type": "artifact", "eco": "php", "label": "Symfony cache & logs", "dirs": ["var/cache", "var/log"], "markers": ["symfony.lock"], "safety": "safe" },
    { "id": "php.phpunit", "type": "artifact", "eco": "php", "label": "PHPUnit cache", "dirs": [".phpunit.cache"], "markers": ["composer.json"], "safety": "safe" },

    { "id": "ruby.bundle", "type": "artifact", "eco": "ruby", "label": "Bundler gems", "dirs": ["vendor/bundle"], "markers": ["Gemfile"], "safety": "rebuild", "restore": "bundle install" },
    { "id": "ruby.tmp", "type": "artifact", "eco": "ruby", "label": "Rails tmp cache", "dirs": ["tmp/cache"], "markers": ["Gemfile"], "safety": "safe" },
    { "id": "dotnet.build", "type": "artifact", "eco": "dotnet", "label": "bin / obj", "dirs": ["bin", "obj"], "markers": ["*.csproj", "*.fsproj", "*.vbproj"], "gitIgnored": true, "safety": "rebuild", "restore": "dotnet build" },
    { "id": "elixir.build", "type": "artifact", "eco": "elixir", "label": "Mix build & deps", "dirs": ["_build", "deps"], "markers": ["mix.exs"], "gitIgnored": true, "safety": "rebuild", "restore": "mix deps.get && mix compile" },
    { "id": "haskell.build", "type": "artifact", "eco": "haskell", "label": "Stack / Cabal build", "dirs": [".stack-work", "dist-newstyle"], "markers": ["stack.yaml", "cabal.project", "*.cabal"], "safety": "rebuild", "restore": "stack build" },
    { "id": "scala.build", "type": "artifact", "eco": "scala", "label": "sbt build", "dirs": ["target", "project/target", ".bloop", ".metals"], "markers": ["build.sbt"], "safety": "rebuild", "restore": "sbt compile" },
    { "id": "cpp.cmake", "type": "artifact", "eco": "cpp", "label": "CMake build", "dirs": ["build", "cmake-build-debug", "cmake-build-release"], "markers": ["CMakeLists.txt"], "gitIgnored": true, "safety": "rebuild", "restore": "cmake --build build" },
    { "id": "zig.build", "type": "artifact", "eco": "zig", "label": "Zig cache", "dirs": [".zig-cache", "zig-cache", "zig-out"], "markers": ["build.zig"], "safety": "rebuild", "restore": "zig build" },
    { "id": "unity.library", "type": "artifact", "eco": "gamedev", "label": "Unity Library", "dirs": ["Library", "Temp", "Obj"], "markers": ["ProjectSettings"], "inside": ["ArtifactDB", "PackageCache", "UnityLockfile"], "safety": "rebuild", "restore": "Reopen the project in Unity" },
    { "id": "godot.cache", "type": "artifact", "eco": "gamedev", "label": "Godot import cache", "dirs": [".godot"], "markers": ["project.godot"], "safety": "safe" },
    { "id": "terraform.modules", "type": "artifact", "eco": "terraform", "label": ".terraform", "dirs": [".terraform"], "inside": ["providers", "modules"], "safety": "rebuild", "restore": "terraform init" },

    { "id": "node.npm-cache", "type": "location", "eco": "node", "category": "caches", "label": "npm cache", "paths": ["~/.npm/_cacache", "~/.npm/_npx"], "safety": "safe" },
    { "id": "node.pnpm-store", "type": "location", "eco": "node", "category": "caches", "label": "pnpm store", "paths": ["~/Library/pnpm/store", "~/.local/share/pnpm/store", "~/.pnpm-store"], "safety": "safe", "restore": "pnpm install" },
    { "id": "node.yarn-cache", "type": "location", "eco": "node", "category": "caches", "label": "Yarn cache", "paths": ["~/Library/Caches/Yarn", "~/.yarn/berry/cache", "~/.cache/yarn"], "safety": "safe" },
    { "id": "node.bun-cache", "type": "location", "eco": "node", "category": "caches", "label": "Bun cache", "paths": ["~/.bun/install/cache"], "safety": "safe" },
    { "id": "node.deno-cache", "type": "location", "eco": "node", "category": "caches", "label": "Deno cache", "paths": ["~/Library/Caches/deno", "~/.cache/deno"], "safety": "safe" },